identity,composite,marcKey,person,roles,title,attribution,provision,subjects,genres,relatedWork,recordId,personId,setfit_prediction,is_parent_category
4552.0,"Title: [Prospectus for Singular pleasures]
Subjects: Mathews, Harry, 1930-2017. Singular pleasures; Annotations (Provenance)--20th century; Miller, Leslie, 1957---Ms. notes
Genres: Book prospectuses; Proofs (Printing)
Provision information: New York: Grenfell Press, [1988?]","7001 $aMiller, Leslie,$d1957-$epublisher.$0http://id.loc.gov/authorities/names/n95028632","Miller, Leslie, 1957-",Publisher,[Prospectus for Singular pleasures],,"New York: Grenfell Press, [1988?]","Mathews, Harry, 1930-2017. Singular pleasures; Annotations (Provenance)--20th century; Miller, Leslie, 1957---Ms. notes",Book prospectuses; Proofs (Printing),,15667904,15667904-78f05853-d554-48ec-bff3-ea2f233d2fd2#http://id.loc.gov/rwo/agents/n95028632,Literature and Narrative Arts,False
4552.0,"Title: The planets
Subjects: Life on other planets--Fiction; Science fiction, American; Planets; Solar system; Life on other planets; Annotations (Provenance)--20th century; Miller, Leslie, 1957---Ms. notes
Genres: Fiction; Proofs (Printing)
Provision information: Toronto; New York: Bantam Books, [1985]; [Advance proofs]","7001 $aMiller, Leslie,$d1957-$ebook designer.$0http://id.loc.gov/authorities/names/n95028632","Miller, Leslie, 1957-",Book designer,The planets,"Byron Preiss, editor ; Dr. Andrew Franknoi, scientific consultant.","Toronto; New York: Bantam Books, [1985] [Advance proofs]","Life on other planets--Fiction; Science fiction, American; Planets; Solar system; Life on other planets; Annotations (Provenance)--20th century; Miller, Leslie, 1957---Ms. notes",Fiction; Proofs (Printing),,15668676,15668676-1415f780-0822-49d7-9d75-cdbc50857211#http://id.loc.gov/rwo/agents/n95028632,Literature and Narrative Arts,False
4552.0,"Title: The stars
Subjects: Annotations (Provenance)--21st century; Miller, Leslie, 1957---Ms. notes
Genres: Proofs (Printing)
Provision information: New York: The Museum of Modern Art, [2005]; Galley proof","7001 $aMiller, Leslie,$d1957-$ebook designer,$eprinter.$0http://id.loc.gov/authorities/names/n95028632","Miller, Leslie, 1957-",Book designer; Printer,The stars,,"New York: The Museum of Modern Art, [2005] Galley proof","Annotations (Provenance)--21st century; Miller, Leslie, 1957---Ms. notes",Proofs (Printing),,15668091,15668091-441aed9e-2874-4775-8089-328e1990a0cc#http://id.loc.gov/rwo/agents/n95028632,Visual Arts and Design,False
4552.0,"Title: Ceramics now: Jane Hartsook Gallery's 2020 exhibition series
Subjects: Ceramic sculpture--21st century--Exhibitions; Pottery--21st century--Exhibitions; Ceramic sculpture; Pottery; 2000-2099
Genres: Catalogs; Exhibition catalogs
Provision information: New York: Greenwich House Pottery, [2020]","7001 $aMiller, Leslie,$d1957-$ebook designer.$0http://id.loc.gov/authorities/names/n95028632","Miller, Leslie, 1957-",Book designer,Ceramics now: Jane Hartsook Gallery's 2020 exhibition series,,"New York: Greenwich House Pottery, [2020]",Ceramic sculpture--21st century--Exhibitions; Pottery--21st century--Exhibitions; Ceramic sculpture; Pottery; 2000-2099,Catalogs; Exhibition catalogs,,16226827,16226827-f32c02a5-7932-403a-bfc1-23bcc8538019#http://id.loc.gov/rwo/agents/n95028632,Visual Arts and Design,False
4552.0,"Title: Gabriel Orozco
Subjects: Orozco, Gabriel, 1962---Exhibitions; Artists--Mexico--Exhibitions; Orozco, Gabriel, 1962-; Artists; Mexico
Genres: Catalogs; Exhibition catalogs
Provision information: México: Museo del Palacio de Bellas Artes, INBA, Editorial de Turner México, 2006; 1st ed.","7001 $aMiller, Leslie,$d1957-$ebook designer.$0http://id.loc.gov/authorities/names/n95028632","Miller, Leslie, 1957-",Book designer,Gabriel Orozco,,"México: Museo del Palacio de Bellas Artes, INBA, Editorial de Turner México, 2006 1st ed.","Orozco, Gabriel, 1962---Exhibitions; Artists--Mexico--Exhibitions; Orozco, Gabriel, 1962-; Artists; Mexico",Catalogs; Exhibition catalogs,,15653735,15653735-9ed5acd4-3603-47d6-9415-c8b1a33362e4#http://id.loc.gov/rwo/agents/n95028632,Visual Arts and Design,False
4552.0,"Title: Thailand: haiku
Subjects: Garfinkel, Gloria, 1929-; Haiku, American; Thailand--Poetry; Thailand--In art; Thailand; Typefaces (Type evidence)--Koch Antiqua
Genres: Poetry; Artists' books; Art
Provision information: [New York?]: [G. Garfinkel], 1997; [New York]: Grenfell Press","7001 $aMiller, Leslie,$d1957-$ebook designer.$0http://id.loc.gov/authorities/names/n95028632","Miller, Leslie, 1957-",Book designer,Thailand: haiku,G. Garfinkel,"[New York?]: [G. Garfinkel], 1997 [New York]: Grenfell Press","Garfinkel, Gloria, 1929-; Haiku, American; Thailand--Poetry; Thailand--In art; Thailand; Typefaces (Type evidence)--Koch Antiqua",Poetry; Artists' books; Art,,15654375,15654375-fa13977d-6239-4a44-8121-5b45fc7012ed#http://id.loc.gov/rwo/agents/n95028632,Literature and Narrative Arts,False
4552.0,"Title: Brice Marden: attendants, bears and rocks
Variant titles: Attendants, bears and rocks
Subjects: Marden, Brice, 1938---Exhibitions; Marden, Brice, 1938-
Genres: Exhibition catalogs
Provision information: New York: Matthew Marks Gallery, 2002","7001 $aMiller, Leslie,$d1957-$ebook designer.$0http://id.loc.gov/authorities/names/n95028632","Miller, Leslie, 1957-",Book designer,"Brice Marden: attendants, bears and rocks",,"New York: Matthew Marks Gallery, 2002","Marden, Brice, 1938---Exhibitions; Marden, Brice, 1938-",Exhibition catalogs,,15653257,15653257-e546f2d6-f368-4a87-b54f-8bf2ac1459b1#http://id.loc.gov/rwo/agents/n95028632,Visual Arts and Design,False
4552.0,"Title: Julian Schnabel: works on paper 1976-1992
Subjects: Schnabel, Julian, 1951---Exhibitions; Schnabel, Julian, 1951-
Genres: Exhibition catalogs
Provision information: New York: Matthew Marks Gallery, [1993]","7001 $aMiller, Leslie,$d1957-$ebook designer.$0http://id.loc.gov/authorities/names/n95028632","Miller, Leslie, 1957-",Book designer,Julian Schnabel: works on paper 1976-1992,interview by Francesco Clemente,"New York: Matthew Marks Gallery, [1993]","Schnabel, Julian, 1951---Exhibitions; Schnabel, Julian, 1951-",Exhibition catalogs,,15638047,15638047-fa9e44c9-8e2f-4e8b-8125-b5de7ad8163e#http://id.loc.gov/rwo/agents/n95028632,Visual Arts and Design,False
4552.0,"Title: Judith Rothschild (1921-1993)
Subjects: Rothschild, Judith--Exhibitions; Painting, American--20th century--Exhibitions; Rothschild, Judith; Painting, American; 1900-1999
Genres: Catalogs; Exhibition catalogs
Provision information: Scottsdale, Ariz: Bentley Gallery, 2001","7001 $aMiller, Leslie,$d1957-$0http://id.loc.gov/authorities/names/n95028632","Miller, Leslie, 1957-",Contributor,Judith Rothschild (1921-1993),,"Scottsdale, Ariz: Bentley Gallery, 2001","Rothschild, Judith--Exhibitions; Painting, American--20th century--Exhibitions; Rothschild, Judith; Painting, American; 1900-1999",Catalogs; Exhibition catalogs,,15668699,15668699-fde534e7-65be-4a5d-8bc5-64a5b02c5e5c#http://id.loc.gov/rwo/agents/n95028632,Visual Arts and Design,False
4552.0,"Title: Ellsworth Kelly: matrix
Variant titles: Matrix
Subjects: Kelly, Ellsworth, 1923-2015--Exhibitions; Kelly, Ellsworth, 1923-2015
Genres: Exhibition catalogs
Provision information: New York, NY: Matthew Marks Gallery, [2003]","7001 $aMiller, Leslie,$d1957-$ebook designer.$0http://id.loc.gov/authorities/names/n95028632","Miller, Leslie, 1957-",Book designer,Ellsworth Kelly: matrix,essay by Benjamin H.D. Buchloh,"New York, NY: Matthew Marks Gallery, [2003]","Kelly, Ellsworth, 1923-2015--Exhibitions; Kelly, Ellsworth, 1923-2015",Exhibition catalogs,,15653258,15653258-40c20224-505c-4aee-a2f3-aae7df2e707b#http://id.loc.gov/rwo/agents/n95028632,Visual Arts and Design,False
4552.0,"Title: Ghost of chance
Subjects: Condo, George; Burroughs, William S., 1914-1997--Autograph; Condo, George--Autograph
Genres: Fiction
Provision information: New York: Library Fellows of the Whitney Museum of American Art, 1991; New York: Grenfell Press","7001 $aMiller, Leslie,$d1957-$ebook designer,$eprinter.$0http://id.loc.gov/authorities/names/n95028632","Miller, Leslie, 1957-",Book designer; Printer,Ghost of chance,written by William S. Burroughs ; illustrated by George Condo,"New York: Library Fellows of the Whitney Museum of American Art, 1991 New York: Grenfell Press","Condo, George; Burroughs, William S., 1914-1997--Autograph; Condo, George--Autograph",Fiction,,15665087,15665087-6130bfd7-4828-413b-82c7-be628f6a04c3#http://id.loc.gov/rwo/agents/n95028632,Visual Arts and Design,False
4574.0,"Title: Three masterworks by Ravel, Chausson, and Françaix - With Yura Lee, Kristin Lee, Richard O'Neill, Nicholas Canellakis, Arnaud Sussmann, and Wu Han: the Chamber Music Society of Lincoln Center
Subjects: String trios; Rhapsodies (Music); Concertos (Violin and piano with string ensemble); concert
Genres: Video recordings; Rhapsodies (Music); Filmed performances; Concertos; Chamber music; Internet videos
Provision information: [Place of publication not identified]: Chamber Music Society of Lincoln Center, 2017","7001 $aWu, Han,$eperformer.$0http://id.loc.gov/authorities/names/n96032818","Wu, Han",Performer,"Three masterworks by Ravel, Chausson, and Françaix - With Yura Lee, Kristin Lee, Richard O'Neill, Nicholas Canellakis, Arnaud Sussmann, and Wu Han: the Chamber Music Society of Lincoln Center",,"[Place of publication not identified]: Chamber Music Society of Lincoln Center, 2017",String trios; Rhapsodies (Music); Concertos (Violin and piano with string ensemble); concert,Video recordings; Rhapsodies (Music); Filmed performances; Concertos; Chamber music; Internet videos,,16043870,16043870-466f43c8-3568-4482-8be3-d9391ff54d15#http://id.loc.gov/rwo/agents/n96032818,"Music, Sound, and Sonic Arts",False
4574.0,"Title: Two Quartets by Kreisler and Mahler - With Daniel Hope, Wu Han, Benjamin Beilman, Danbi Um, Paul Neubauer, and David Finckel: the Chamber Music Society of Lincoln Center
Subjects: String quartets; Piano quartets; concert
Genres: Video recordings; Filmed performances; Chamber music; Internet videos
Provision information: [Place of publication not identified]: CMS Chamber Music Society of Lincoln Center, [201-?]","7001 $aWu, Han,$eperformer.$0http://id.loc.gov/authorities/names/n96032818","Wu, Han",Performer,"Two Quartets by Kreisler and Mahler - With Daniel Hope, Wu Han, Benjamin Beilman, Danbi Um, Paul Neubauer, and David Finckel: the Chamber Music Society of Lincoln Center",,"[Place of publication not identified]: CMS Chamber Music Society of Lincoln Center, [201-?]",String quartets; Piano quartets; concert,Video recordings; Filmed performances; Chamber music; Internet videos,,16043885,16043885-4324e15e-149f-4e6b-982e-60e8c57e41a8#http://id.loc.gov/rwo/agents/n96032818,"Music, Sound, and Sonic Arts",False
4574.0,"Title: The Chamber Music Society of Lincoln Center plays Dvořák, Bernstein, Copland and Burleigh: 50th anniversary of the Chamber Music Society of Lincoln Center
Subjects: Ballets--Excerpts; concert
Genres: Video recordings; Suites; Sonatas; Filmed performances; Dance music; Chamber music; Internet videos
Provision information: [Place of publication not identified]: Chamber Music Society of Lincoln Center, 2019","7001 $aWu, Han,$eperformer.$0http://id.loc.gov/authorities/names/n96032818","Wu, Han",Performer,"The Chamber Music Society of Lincoln Center plays Dvořák, Bernstein, Copland and Burleigh: 50th anniversary of the Chamber Music Society of Lincoln Center",,"[Place of publication not identified]: Chamber Music Society of Lincoln Center, 2019",Ballets--Excerpts; concert,Video recordings; Suites; Sonatas; Filmed performances; Dance music; Chamber music; Internet videos,,16043874,16043874-65eb2fbe-e045-43f9-b784-95e5769d89c4#http://id.loc.gov/rwo/agents/n96032818,"Music, Sound, and Sonic Arts",False
4574.0,"Title: Master class with Wu Han: Chamber Music Society of Lincoln Center
Subjects: masterclass
Genres: Video recordings; Filmed performances; Chamber music; Internet videos
Provision information: [Place of publication not identified]: [publisher not identified], 2019","7001 $aWu, Han,$eperformer.$0http://id.loc.gov/authorities/names/n96032818","Wu, Han",Performer,Master class with Wu Han: Chamber Music Society of Lincoln Center,,"[Place of publication not identified]: [publisher not identified], 2019",masterclass,Video recordings; Filmed performances; Chamber music; Internet videos,,16043779,16043779-5e5ff9a6-b9a3-49b2-baf2-71b85512b256#http://id.loc.gov/rwo/agents/n96032818,"Music, Sound, and Sonic Arts",False
58.0,"Title: Tiger's eye records
Subjects: Albers, Josef; Abel, Lionel; Aiken, Conrad, 1889-1973; Arp, Jean, 1887-1966; Barnard, Mary; Barrault, Jean-Louis, 1910-1994; Bataille, Georges, 1897-1962; Borges, Jorge Luis, 1899-1986; Brooks, Van Wyck, 1886-1963; Char, René, 1907-1988; Crews, Judson; Cummings, E. E. (Edward Estlin), 1894-1962; Dodson, Owen, 1914-1983; Eberhart, Richard, 1904-2005; Eliot, T. S. (Thomas Stearns), 1888-1965; Ernst, Max, 1891-1976; Fitts, Dudley, 1903-1968; Ford, Charles Henri; Garrigue, Jean, 1912-1972; Genet, Jean, 1910-1986; Gregory, Horace, 1898-1982; Hays, H. R. (Hoffman Reynolds), 1904-1980; MacIver, Loren, 1909-1998; Moore, Marianne, 1887-1972; Moss, Stanley; Neruda, Pablo, 1904-1973; Nin, Anaïs, 1903-1977; Pasternak, Boris Leonidovich, 1890-1960; Prévert, Jacques, 1900-1977; Queneau, Raymond, 1903-1976; Rexroth, Kenneth, 1905-1982; Roethke, Theodore, 1908-1963; Roskolenko, Harry; Seligmann, Kurt, 1900-1962; Stamos, Theodoros, 1922-1997; Tyler, Parker; Stephan, John Walter, 1906-1995; Stephan, Ruth, 1910-1974; Vazakas, Byron; Weber, Brom, 1917-1998; Wilbur, Richard, 1921-2017; Williams, William Carlos, 1883-1963; Wright, Richard, 1908-1960; Young, Marguerite, 1908-1995; Tiger's Eye; Tiger's eye; Art--Periodicals; Authors and publishers--United States; Editors--United States; Literature--Periodicals; Little magazines--Archives; Periodicals--Publishing--United States; Editors","60010$aLaughlin, James,$d1914-1997.$0http://id.loc.gov/authorities/names/n83177320","Laughlin, James, 1914-1997",Subject,Tiger's eye records,,,"Albers, Josef; Abel, Lionel; Aiken, Conrad, 1889-1973; Arp, Jean, 1887-1966; Barnard, Mary; Barrault, Jean-Louis, 1910-1994; Bataille, Georges, 1897-1962; Borges, Jorge Luis, 1899-1986; Brooks, Van Wyck, 1886-1963; Char, René, 1907-1988; Crews, Judson; Cummings, E. E. (Edward Estlin), 1894-1962; Dodson, Owen, 1914-1983; Eberhart, Richard, 1904-2005; Eliot, T. S. (Thomas Stearns), 1888-1965; Ernst, Max, 1891-1976; Fitts, Dudley, 1903-1968; Ford, Charles Henri; Garrigue, Jean, 1912-1972; Genet, Jean, 1910-1986; Gregory, Horace, 1898-1982; Hays, H. R. (Hoffman Reynolds), 1904-1980; MacIver, Loren, 1909-1998; Moore, Marianne, 1887-1972; Moss, Stanley; Neruda, Pablo, 1904-1973; Nin, Anaïs, 1903-1977; Pasternak, Boris Leonidovich, 1890-1960; Prévert, Jacques, 1900-1977; Queneau, Raymond, 1903-1976; Rexroth, Kenneth, 1905-1982; Roethke, Theodore, 1908-1963; Roskolenko, Harry; Seligmann, Kurt, 1900-1962; Stamos, Theodoros, 1922-1997; Tyler, Parker; Stephan, John Walter, 1906-1995; Stephan, Ruth, 1910-1974; Vazakas, Byron; Weber, Brom, 1917-1998; Wilbur, Richard, 1921-2017; Williams, William Carlos, 1883-1963; Wright, Richard, 1908-1960; Young, Marguerite, 1908-1995; Tiger's Eye; Tiger's eye; Art--Periodicals; Authors and publishers--United States; Editors--United States; Literature--Periodicals; Little magazines--Archives; Periodicals--Publishing--United States; Editors",,,3831065,3831065-101d51ea-d399-4334-aa63-47b8316add8c#http://id.loc.gov/rwo/agents/n83177320,Literature and Narrative Arts,False
82.0,"Title: Rowlandson : watercolours and drawings
Subjects: Rowlandson, Thomas, 1756-1827; Rowlandson, Thomas
Genres: Biographies
Provision information: London: Phaidon Press Limited, 1972; New York: Distributed by Praeger Publishers","7001 $aRowlandson, Thomas,$d1756-1827.$0http://id.loc.gov/authorities/names/n50022330","Rowlandson, Thomas, 1756-1827",Contributor,Rowlandson : watercolours and drawings,[by] John Hayes,"London: Phaidon Press Limited, 1972 New York: Distributed by Praeger Publishers","Rowlandson, Thomas, 1756-1827; Rowlandson, Thomas",Biographies,,3611491,3611491-12cf28dc-8623-47ed-9b77-bc25603eff6e#http://id.loc.gov/rwo/agents/n50022330,Visual Arts and Design,False
82.0,"Title: Rowlandson : watercolours and drawings
Subjects: Rowlandson, Thomas
Genres: Biographies
Provision information: London: Phaidon Press Limited, 1972; New York: Distributed by Praeger Publishers","60010$aRowlandson, Thomas,$d1756-1827.$0http://id.loc.gov/authorities/names/n50022330","Rowlandson, Thomas, 1756-1827",Subject,Rowlandson : watercolours and drawings,[by] John Hayes,"London: Phaidon Press Limited, 1972 New York: Distributed by Praeger Publishers","Rowlandson, Thomas",Biographies,,3611491,3611491-5d027d47-99c6-4f09-b615-a475bcd73d85#http://id.loc.gov/rwo/agents/n50022330,Visual Arts and Design,False
216.0,"Title: Painting in England 1700-1850: collection of Mr. & Mrs. Paul Mellon
Subjects: Mellon, Paul--Art collections--Exhibitions; Mellon, Paul, Mrs--Art collections--Exhibitions; Painting, English--Exhibitions; Painting--Private collections; Painting, English; Painting, English--18th century--Exhibitions; Painting, English--19th century--Exhibitions; Painting, Modern--17th-18th centuries--Great Britain--Exhibitions; Painting, Modern--19th century--Great Britain--Exhibitions
Genres: Exhibition catalogues; Exhibition catalogs
Provision information: Richmond: Virginia Museum of Fine Arts, 1963","7001 $aMellon, Paul,$cMrs.$0http://id.loc.gov/authorities/names/n50013907","Mellon, Paul, Mrs",Contributor,Painting in England 1700-1850: collection of Mr. & Mrs. Paul Mellon,[catalogue by Basil Taylor],"Richmond: Virginia Museum of Fine Arts, 1963","Mellon, Paul--Art collections--Exhibitions; Mellon, Paul, Mrs--Art collections--Exhibitions; Painting, English--Exhibitions; Painting--Private collections; Painting, English; Painting, English--18th century--Exhibitions; Painting, English--19th century--Exhibitions; Painting, Modern--17th-18th centuries--Great Britain--Exhibitions; Painting, Modern--19th century--Great Britain--Exhibitions",Exhibition catalogues; Exhibition catalogs,,3518046,3518046-df4ad203-badd-4813-b49e-7b4d975ec437#http://id.loc.gov/rwo/agents/n50013907,Visual Arts and Design,False
504.0,"Title: Morris Tyler family collection of John James Audubon
Subjects: Abert, John James, 1788-1863; Audubon family; Audubon, John James, 1785-1851; Audubon, John Woodhouse, 1812-1862; Audubon, Lucy Green Bakewell, 1788-1874; Audubon, Victor Gifford, 1809-1860; Bachman, John, 1790-1874; Baird, Spencer Fullerton, 1823-1887; Bakewell, Thomas Woodhouse, 1861-1909; Bakewell, William Gifford; Bonaparte, Charles Lucian, 1803-1857; Fleming, William, 1791-1866; Harlan, Richard, 1796-1843; Harris, Edward, 1799-1863; Havell, Robert, 1793-1878; Heppenstall, Rayner, 1911-1981; Howe, Hezekiah, 1775-1838; Kidd, John Bartholomew; Morton, Samuel George, 1799-1851; James Munroe and Company; Smith, English & Co; Birds--North America; Booksellers and bookselling--Connecticut--New Haven; Mammals--United States; Natural history--United States; Ornithologists--United States; Publishers and publishing--Connecticut--New Haven; Publishers and publishing--Massachusetts--Boston; Publishers and publishing--Pennsylvania--Philadelphia; Wildlife artists--United States
Genres: Autographs (manuscripts); Scrapbooks","60010$aClay, Henry,$d1777-1852.$0http://id.loc.gov/authorities/names/n50041909","Clay, Henry, 1777-1852",Subject,Morris Tyler family collection of John James Audubon,,,"Abert, John James, 1788-1863; Audubon family; Audubon, John James, 1785-1851; Audubon, John Woodhouse, 1812-1862; Audubon, Lucy Green Bakewell, 1788-1874; Audubon, Victor Gifford, 1809-1860; Bachman, John, 1790-1874; Baird, Spencer Fullerton, 1823-1887; Bakewell, Thomas Woodhouse, 1861-1909; Bakewell, William Gifford; Bonaparte, Charles Lucian, 1803-1857; Fleming, William, 1791-1866; Harlan, Richard, 1796-1843; Harris, Edward, 1799-1863; Havell, Robert, 1793-1878; Heppenstall, Rayner, 1911-1981; Howe, Hezekiah, 1775-1838; Kidd, John Bartholomew; Morton, Samuel George, 1799-1851; James Munroe and Company; Smith, English & Co; Birds--North America; Booksellers and bookselling--Connecticut--New Haven; Mammals--United States; Natural history--United States; Ornithologists--United States; Publishers and publishing--Connecticut--New Haven; Publishers and publishing--Massachusetts--Boston; Publishers and publishing--Pennsylvania--Philadelphia; Wildlife artists--United States",Autographs (manuscripts); Scrapbooks,,3750575,3750575-01e78f3f-8e39-4f0a-90d5-d613cad4bbbc#http://id.loc.gov/rwo/agents/n50041909,Visual Arts and Design,False
551.0,"Title: Address by Hon. Edward Everett: delivered in Faneuil Hall, October 19, 1864 : the duty of supporting the government in the present crisis of affairs
Subjects: United States--Politics and government--1861-1865; Secession--Southern States; Politics and government; Secession; Southern States; United States; 1861-1865; Campaign literature--1864--Republican
Genres: Tracts (literary genre)
Provision information: [Boston]: [New England Loyal Publication Society], [1864?]","1001 $aEverett, Edward,$d1794-1865,$eauthor.$1https://id.oclc.org/worldcat/entity/E39PBJhtbCt8pGCJHMdDh9PG73","Everett, Edward, 1794-1865",Author,"Address by Hon. Edward Everett: delivered in Faneuil Hall, October 19, 1864 : the duty of supporting the government in the present crisis of affairs",,"[Boston]: [New England Loyal Publication Society], [1864?]",United States--Politics and government--1861-1865; Secession--Southern States; Politics and government; Secession; Southern States; United States; 1861-1865; Campaign literature--1864--Republican,Tracts (literary genre),,3284385,3284385-ebc580ae-6a1e-4c53-b1ca-2246e1de8ea6#https://id.oclc.org/worldcat/entity/E39PBJhtbCt8pGCJHMdDh9PG73,"Politics, Policy, and Government",False
4463.0,"Title: Bericht uber die Thatigkeit der Schlafkrankheits-Expedition...: Bugalla, 27th Nov., 1906; [Sese bei Entebbe (Uganda) den 25th April 1907; Sese den 5th Sept. 1907]
Subjects: African trypanosomiasis--Uganda; Epidemic encephalitis--Uganda","1001 $aKoch, Robert,$d1843-1910.$0http://id.loc.gov/authorities/names/n50043984","Koch, Robert, 1843-1910",Contributor,"Bericht uber die Thatigkeit der Schlafkrankheits-Expedition...: Bugalla, 27th Nov., 1906; [Sese bei Entebbe (Uganda) den 25th April 1907; Sese den 5th Sept. 1907]",,,African trypanosomiasis--Uganda; Epidemic encephalitis--Uganda,,,3661422,3661422-99f581f8-b15a-4f50-b135-36c05a57b128#http://id.loc.gov/rwo/agents/n50043984,"Medicine, Health, and Clinical Sciences",False
54.0,"Title: Strauss contra Wagner
Subjects: Wagner, Richard, 1813-1883; Strauss, Richard; Wagner, Richard
Provision information: Berlin, Leipzig: Schuster & Loeffler, 1902","60010$aStrauss, Richard,$d1864-1949.$0http://id.loc.gov/authorities/names/n79041680","Strauss, Richard, 1864-1949",Subject,Strauss contra Wagner,von dr. Erich Urban.,"Berlin, Leipzig: Schuster & Loeffler, 1902","Wagner, Richard, 1813-1883; Strauss, Richard; Wagner, Richard",,,4242131,4242131-4f2b8299-0cf0-4a00-b77d-1477b9176579#http://id.loc.gov/rwo/agents/n79041680,"Music, Sound, and Sonic Arts",False
