identity,composite,marcKey,person,roles,title,attribution,provision,subjects,genres,relatedWork,recordId,personId,setfit_prediction,is_parent_category
82.0,"Title: The infant Hercules
Subjects: Pitt, William, 1759-1806--Caricatures and cartoons; Fox, Charles James, 1749-1806--Caricatures and cartoons; North, Frederick, Lord, 1732-1792--Caricatures and cartoons; East India Company; Great Britain--Politics and government--1760-1789; Snakes; Shields; Satires (Visual works)--England--1784; Etchings--England--London--1868
Genres: graphic; Restrikes
Provision information: [London]: Pubd. Feby. 3d, 1784, by W. Humphrey, No. 227 Strand, [3 Feburary 1784]; [London]: [Field & Tuer], [approximately 1868?]","1001 $aRowlandson, Thomas,$d1756-1827,$eprintmaker.$0http://id.loc.gov/authorities/names/n50022330","Rowlandson, Thomas, 1756-1827",Printmaker,The infant Hercules,,"[London]: Pubd. Feby. 3d, 1784, by W. Humphrey, No. 227 Strand, [3 Feburary 1784] [London]: [Field & Tuer], [approximately 1868?]","Pitt, William, 1759-1806--Caricatures and cartoons; Fox, Charles James, 1749-1806--Caricatures and cartoons; North, Frederick, Lord, 1732-1792--Caricatures and cartoons; East India Company; Great Britain--Politics and government--1760-1789; Snakes; Shields; Satires (Visual works)--England--1784; Etchings--England--London--1868",graphic; Restrikes,,15539225,15539225-78bc440e-1688-4e0f-b26b-cacc3ba54263#http://id.loc.gov/rwo/agents/n50022330,Visual Arts and Design,False
82.0,"Title: The Easter hunt
Subjects: Hunting; Horseback riding; Dogs; Signs (Notices); Satires (Visual works)--England--1800; Etchings--England--London--1868
Genres: graphic; Restrikes
Provision information: [London]: [Field & Tuer], [approximately 1868?]","1001 $aRowlandson, Thomas,$d1756-1827,$eprintmaker.$0http://id.loc.gov/authorities/names/n50022330","Rowlandson, Thomas, 1756-1827",Printmaker,The Easter hunt,H. Bunbury del,"[London]: [Field & Tuer], [approximately 1868?]",Hunting; Horseback riding; Dogs; Signs (Notices); Satires (Visual works)--England--1800; Etchings--England--London--1868,graphic; Restrikes,,15546375,15546375-338aea9c-bdb9-4fb5-af2b-89d6c8709ce2#http://id.loc.gov/rwo/agents/n50022330,Visual Arts and Design,False
82.0,"Title: [The incurable]
Variant titles: Dazzled with hope he could not see the cheat ...
Subjects: Fox, Charles James, 1749-1806--Caricatures and cartoons; Monro, John, 1715-1791--Caricatures and cartoons; Great Britain--Politics and government--1760-1789; Mentally ill persons; Physicians; Physical restraints; Quizzing glasses; Satires (Visual works)--England--1784; Etchings--England--London--1868
Genres: graphic; Restrikes
Provision information: [London]: Pubd. April 4th, 1784, by W. Humphry, No. 227 Strand, [4 April 1784]; [London]: [Field & Tuer], [approximately 1868?]","1001 $aRowlandson, Thomas,$d1756-1827,$eprintmaker.$0http://id.loc.gov/authorities/names/n50022330","Rowlandson, Thomas, 1756-1827",Printmaker,[The incurable],,"[London]: Pubd. April 4th, 1784, by W. Humphry, No. 227 Strand, [4 April 1784] [London]: [Field & Tuer], [approximately 1868?]","Fox, Charles James, 1749-1806--Caricatures and cartoons; Monro, John, 1715-1791--Caricatures and cartoons; Great Britain--Politics and government--1760-1789; Mentally ill persons; Physicians; Physical restraints; Quizzing glasses; Satires (Visual works)--England--1784; Etchings--England--London--1868",graphic; Restrikes,,15541201,15541201-7ad45b98-5c00-4231-b45d-3e4b2c5d00a9#http://id.loc.gov/rwo/agents/n50022330,Visual Arts and Design,False
115.0,"Title: Hogarth and Europe
Subjects: Hogarth, William, 1697-1764--Exhibitions; Hogarth, William, 1697-1764--Criticism and interpretation; Hogarth, William, 1697-1764--Influence; Art, European--18th century--Exhibitions; Hogarth, William, 1697-1764; Art, European; Influence (Literary, artistic, etc.); 1700-1799
Genres: Catalogs; exhibition catalogs; Criticism, interpretation, etc.
Provision information: London: Tate Publishing, 2021; New York, NY: ABRAMS","7001 $aHogarth, William,$d1697-1764,$eartist.$0http://id.loc.gov/authorities/names/n80126106","Hogarth, William, 1697-1764",Artist,Hogarth and Europe,"edited by Alice Insley and Martin Myrone ; contributions by Sonia E. Barrett, Josephina de Fouw, Meredith Gamer, Cora Gilroy-Ware, Lubaina Himid, Alice Insley, Paul Knolle, Gerhard de Kok, Martin Myrone, Temi Odumosu, Stacey Sloboda, Lars Tharp, Hannah Williams and Jonny Yarker","London: Tate Publishing, 2021 New York, NY: ABRAMS","Hogarth, William, 1697-1764--Exhibitions; Hogarth, William, 1697-1764--Criticism and interpretation; Hogarth, William, 1697-1764--Influence; Art, European--18th century--Exhibitions; Hogarth, William, 1697-1764; Art, European; Influence (Literary, artistic, etc.); 1700-1799","Catalogs; exhibition catalogs; Criticism, interpretation, etc.",,16079506,16079506-12914524-247d-458d-84b3-699d45c837e3#http://id.loc.gov/rwo/agents/n80126106,Visual Arts and Design,False
450.0,"Title: Chu ci ji zhu; 楚辭集注
Subjects: Chu ci (Ancient Chinese poems)
Provision information: Wuhan: Hubei ren min chu ban she, 2017; 武漢: 湖北人民出版社, 2017; Di 1 ban; 第1版","1001 $6880-01$aZhu, Xi,$d1130-1200,$eauthor.$0http://id.loc.gov/authorities/names/n81008179 8801 $6100-01/$1$a朱熹,$d1130-1200,$eauthor.","Zhu, Xi, 1130-1200 朱熹, 1130-1200",Author,Chu ci ji zhu; 楚辭集注,(Song) Zhu Xi ji zhu ; Huang Linggeng dian jiao (宋) 朱熹集注 ; 黃靈庚點校,"Wuhan: Hubei ren min chu ban she, 2017 武漢: 湖北人民出版社, 2017 Di 1 ban 第1版",Chu ci (Ancient Chinese poems),,,16175648,16175648-cb65f025-fe60-48b1-b442-b585e38af5eb#http://id.loc.gov/rwo/agents/n81008179,Literature and Narrative Arts,False
511.0,"Title: The principles of ethics
Subjects: Ethics; Ethics, Evolutionary; Gray, Bradford H., 1942---Ownership; United Oxford and Cambridge University Club. Library--Stamp
Provision information: London: Williams and Norgate, 1892-1893","1001 $aSpencer, Herbert,$d1820-1903,$eauthor.$0http://id.loc.gov/authorities/names/n80038441","Spencer, Herbert, 1820-1903",Author,The principles of ethics,by Herbert Spencer,"London: Williams and Norgate, 1892-1893","Ethics; Ethics, Evolutionary; Gray, Bradford H., 1942---Ownership; United Oxford and Cambridge University Club. Library--Stamp",,,15805682,15805682-90f9c402-f198-44d1-899d-72f8676ec661#http://id.loc.gov/rwo/agents/n80038441,Philosophy and Ethics,False
511.0,"Title: What knowledge is of most worth?
Subjects: Education--Philosophy; Gray, Bradford H., 1942---Ownership
Provision information: [New York?]: [Popular Science Publishing Company?], [1904?]","1001 $aSpencer, Herbert,$d1820-1903,$eauthor.$0http://id.loc.gov/authorities/names/n80038441","Spencer, Herbert, 1820-1903",Author,What knowledge is of most worth?,by the late Herbert Spencer. The progress of science : Herbert Spencer.,"[New York?]: [Popular Science Publishing Company?], [1904?]","Education--Philosophy; Gray, Bradford H., 1942---Ownership",,,15877565,15877565-cd0d9d65-1b15-4dba-9109-19284c55c26f#http://id.loc.gov/rwo/agents/n80038441,Philosophy and Ethics,False
531.0,"Title: A previous life: another posthumous novel
Subjects: Man-woman relationships--Fiction
Genres: Fiction
Provision information: London: Bloomsbury Publishing, 2021","1001 $aWhite, Edmund,$eauthor.$0http://id.loc.gov/authorities/names/nr97036515","White, Edmund",Author,A previous life: another posthumous novel,Edmund White,"London: Bloomsbury Publishing, 2021",Man-woman relationships--Fiction,Fiction,,16124651,16124651-7b671856-974c-49e0-8ad4-deb278a2138a#http://id.loc.gov/rwo/agents/nr97036515,Literature and Narrative Arts,False
531.0,"Title: If you kept a record of sins
Subjects: Mothers and sons--Fiction; Mothers--Death--Fiction; Romania--Fiction
Genres: Fiction
Provision information: Brooklyn, NY: Archipelago Books, 2021; First Archipelago Books edition","7001 $aWhite, Edmund,$d1940-$ewriter of afterword.$0http://id.loc.gov/authorities/names/n79082217","White, Edmund, 1940-",Writer of afterword,If you kept a record of sins,Andrea Bajani ; translated from the Italian by Elizabeth Harris ; afterword by Edmund White,"Brooklyn, NY: Archipelago Books, 2021 First Archipelago Books edition",Mothers and sons--Fiction; Mothers--Death--Fiction; Romania--Fiction,Fiction,,15807322,15807322-2c9346f9-9008-473b-baa3-848143a95b79#http://id.loc.gov/rwo/agents/n79082217,Literature and Narrative Arts,False
602.0,"Title: The Wonderful game of Oz
Related work: Wizard of Oz
Subjects: Hugel, George F.--Autograph
Genres: Puzzles and games; Games
Provision information: Salem, Mass; New York; London: Parker Bros, ©1921","7001 $aBaum, L. Frank$q(Lyman Frank),$d1856-1919.$tWizard of Oz.$0http://id.loc.gov/authorities/names/n81036429","Baum, L. Frank (Lyman Frank), 1856-1919",Contributor,The Wonderful game of Oz,,"Salem, Mass; New York; London: Parker Bros, ©1921","Hugel, George F.--Autograph",Puzzles and games; Games,Wizard of Oz,16210728,16210728-d4acffaa-79c7-45d9-9a7f-29ba4b722ee6#http://id.loc.gov/rwo/agents/n81036429,Literature and Narrative Arts,False
622.0,"Title: Shi ji zhi yi; 史記志疑
Subjects: Sima, Qian, approximately 145 B.C.-approximately 86 B.C. Shi ji; 司馬遷, approximately 145-approximately 86 B.C. 史記; Shi ji (Sima, Qian); China--History--To 221 B.C; China--History--Qin dynasty, 221-207 B.C; China--History--Han dynasty, 202 B.C.-220 A.D; China; To 220
Genres: History
Provision information: Beijing: Zhonghua shu ju, Xin hua shu dian Beijing fa xing suo fa xing, 1981; 北京: 中華書局, 新華書店北京发行所发行, 1981; Di 1 ban; 第1版","60010$6880-06$aSima, Qian,$dapproximately 145 B.C.-approximately 86 B.C.$tShi ji.$0http://id.loc.gov/authorities/names/n79081033 88014$6600-06/$1$a司馬遷,$dapproximately 145-approximately 86 B.C.$t史記.","Sima, Qian, approximately 145 B.C.-approximately 86 B.C. 司馬遷, approximately 145-approximately 86 B.C.",Subject,Shi ji zhi yi; 史記志疑,Liang Yusheng zhuan 梁玉繩撰,"Beijing: Zhonghua shu ju, Xin hua shu dian Beijing fa xing suo fa xing, 1981 北京: 中華書局, 新華書店北京发行所发行, 1981 Di 1 ban 第1版","Sima, Qian, approximately 145 B.C.-approximately 86 B.C. Shi ji; 司馬遷, approximately 145-approximately 86 B.C. 史記; Shi ji (Sima, Qian); China--History--To 221 B.C; China--History--Qin dynasty, 221-207 B.C; China--History--Han dynasty, 202 B.C.-220 A.D; China; To 220",History,,15571221,15571221-a4414563-5af1-43be-bee5-2fd407e75d0a#http://id.loc.gov/rwo/agents/n79081033,"History, Heritage, and Memory",False
622.0,"Title: Shi ji zhi yi; 史記志疑
Subjects: Sima, Qian, approximately 145 B.C.-approximately 86 B.C. Shi ji; 司馬遷, approximately 145-approximately 86 B.C. 史記; Shi ji (Sima, Qian); China--History--To 221 B.C; China--History--Qin dynasty, 221-207 B.C; China--History--Han dynasty, 202 B.C.-220 A.D; China; To 220
Genres: History
Provision information: Beijing: Zhonghua shu ju, Xin hua shu dian Beijing fa xing suo fa xing, 1981; 北京: 中華書局, 新華書店北京发行所发行, 1981; Di 1 ban; 第1版","60014$6880-07$aSima, Qian,$dapproximately 145 B.C.-approximately 86 B.C.$tShi ji.$0http://id.loc.gov/authorities/names/n79081033 88014$6600-07/$1$a司馬遷,$dapproximately 145-approximately 86 B.C.$t史記.","Sima, Qian, approximately 145 B.C.-approximately 86 B.C. 司馬遷, approximately 145-approximately 86 B.C.",Subject,Shi ji zhi yi; 史記志疑,Liang Yusheng zhuan 梁玉繩撰,"Beijing: Zhonghua shu ju, Xin hua shu dian Beijing fa xing suo fa xing, 1981 北京: 中華書局, 新華書店北京发行所发行, 1981 Di 1 ban 第1版","Sima, Qian, approximately 145 B.C.-approximately 86 B.C. Shi ji; 司馬遷, approximately 145-approximately 86 B.C. 史記; Shi ji (Sima, Qian); China--History--To 221 B.C; China--History--Qin dynasty, 221-207 B.C; China--History--Han dynasty, 202 B.C.-220 A.D; China; To 220",History,,15571221,15571221-f8fe3931-dcf1-4503-903f-2f27983c18eb#http://id.loc.gov/rwo/agents/n79081033,"History, Heritage, and Memory",False
622.0,"Title: Shi ji zhi yi; 史記志疑
Related work: Shi ji史記
Subjects: Sima, Qian, approximately 145 B.C.-approximately 86 B.C. Shi ji; 司馬遷, approximately 145-approximately 86 B.C. 史記; Shi ji (Sima, Qian); China--History--To 221 B.C; China--History--Qin dynasty, 221-207 B.C; China--History--Han dynasty, 202 B.C.-220 A.D; China; To 220
Genres: History
Provision information: Beijing: Zhonghua shu ju, Xin hua shu dian Beijing fa xing suo fa xing, 1981; 北京: 中華書局, 新華書店北京发行所发行, 1981; Di 1 ban; 第1版","70012$6880-08$aSima, Qian,$dapproximately 145 B.C.-approximately 86 B.C.$tShi ji.$0http://id.loc.gov/authorities/names/n50027264 88012$6700-08/$1$a司馬遷,$dapproximately 145-approximately 86 B.C.$t史記.","Sima, Qian, approximately 145 B.C.-approximately 86 B.C. 司馬遷, approximately 145-approximately 86 B.C.",Contributor,Shi ji zhi yi; 史記志疑,Liang Yusheng zhuan 梁玉繩撰,"Beijing: Zhonghua shu ju, Xin hua shu dian Beijing fa xing suo fa xing, 1981 北京: 中華書局, 新華書店北京发行所发行, 1981 Di 1 ban 第1版","Sima, Qian, approximately 145 B.C.-approximately 86 B.C. Shi ji; 司馬遷, approximately 145-approximately 86 B.C. 史記; Shi ji (Sima, Qian); China--History--To 221 B.C; China--History--Qin dynasty, 221-207 B.C; China--History--Han dynasty, 202 B.C.-220 A.D; China; To 220",History,Shi ji 史記,15571221,15571221-18262503-e596-4886-a6bc-c42d06ef9a82#http://id.loc.gov/rwo/agents/n50027264,"History, Heritage, and Memory",False
625.0,"Title: Art songs for high voice
Subjects: Songs (High voice) with piano; Vocalises (High voice) with piano; Dickinson, Emily, 1830-1886--Musical settings; Allen, Glen--Musical settings; Browning, Elizabeth Barrett, 1806-1861--Musical settings; King, Martin Luther, Jr., 1929-1968--Musical settings; Wordsworth, William, 1770-1850--Musical settings; Brooks, Phillips, 1835-1893--Musical settings; Dunbar, Paul Laurence, 1872-1906--Musical settings; Harris, Wilson--Musical settings; Stevenson, Robert Louis, 1850-1894--Musical settings
Genres: Art music; Songs; Vocalises; Scores
Provision information: Fayetteville, AR: Classical Vocal Reprints, [2021]","7001 $aBrowning, Elizabeth Barrett,$d1806-1861,$eauthor.$0http://id.loc.gov/authorities/names/n79067862","Browning, Elizabeth Barrett, 1806-1861",Author,Art songs for high voice,"Adolphus Hailstork ; Louise Toppin, editor","Fayetteville, AR: Classical Vocal Reprints, [2021]","Songs (High voice) with piano; Vocalises (High voice) with piano; Dickinson, Emily, 1830-1886--Musical settings; Allen, Glen--Musical settings; Browning, Elizabeth Barrett, 1806-1861--Musical settings; King, Martin Luther, Jr., 1929-1968--Musical settings; Wordsworth, William, 1770-1850--Musical settings; Brooks, Phillips, 1835-1893--Musical settings; Dunbar, Paul Laurence, 1872-1906--Musical settings; Harris, Wilson--Musical settings; Stevenson, Robert Louis, 1850-1894--Musical settings",Art music; Songs; Vocalises; Scores,,16036257,16036257-27bef4de-018a-4c33-ab48-b3a3de13dac4#http://id.loc.gov/rwo/agents/n79067862,"Music, Sound, and Sonic Arts",False
648.0,"Title: Lucan's Pharsalia (1627)
Variant titles: Thomas May, Lucan's Pharsalia (1627)
Subjects: May, Thomas, 1595-1650; Epic poetry, Latin--Translations into English; Rome--History--Civil War, 49-45 B.C.--Poetry; Pharsalus, Battle of, Farsala, Greece, 48 B.C.--Poetry
Provision information: Cambridge, United Kingdom: The Modern Humanities Research Association, 2020","1000 $aLucan,$d39-65,$eauthor.$0http://id.loc.gov/authorities/names/n79089234","Lucan, 39-65",Author,Lucan's Pharsalia (1627),Thomas May ; edited by Emma Buckley and Edward Paleit,"Cambridge, United Kingdom: The Modern Humanities Research Association, 2020","May, Thomas, 1595-1650; Epic poetry, Latin--Translations into English; Rome--History--Civil War, 49-45 B.C.--Poetry; Pharsalus, Battle of, Farsala, Greece, 48 B.C.--Poetry",,,16092600,16092600-aa75577e-af5e-4238-a46b-c0eb1ec087d0#http://id.loc.gov/rwo/agents/n79089234,Literature and Narrative Arts,False
648.0,"Title: Lucan's Pharsalia (1627)
Variant titles: Thomas May, Lucan's Pharsalia (1627)
Version of: Pharsalia. English
Subjects: May, Thomas, 1595-1650; Epic poetry, Latin--Translations into English; Rome--History--Civil War, 49-45 B.C.--Poetry; Pharsalus, Battle of, Farsala, Greece, 48 B.C.--Poetry
Provision information: Cambridge, United Kingdom: The Modern Humanities Research Association, 2020","1000 $aLucan,$d39-65,$eauthor.$0http://id.loc.gov/authorities/names/n79089234","Lucan, 39-65",Author,Lucan's Pharsalia (1627),Thomas May ; edited by Emma Buckley and Edward Paleit,"Cambridge, United Kingdom: The Modern Humanities Research Association, 2020","May, Thomas, 1595-1650; Epic poetry, Latin--Translations into English; Rome--History--Civil War, 49-45 B.C.--Poetry; Pharsalus, Battle of, Farsala, Greece, 48 B.C.--Poetry",,Pharsalia. English,16092600,16092600-1e4ee236-d5f7-4d98-9fe5-57b066b1a439#http://id.loc.gov/authorities/names/n85143923-Agent,Literature and Narrative Arts,False
4438.1,"Title: Husbands: a comedy about life and death and freedom
Subjects: Husbands--New York (State)--New York--Drama; Midlife crisis--New York (State)--New York--Drama; Short vacations--England--London--Drama; Sudden death--New York (State)--New York--Drama; Husbands; Midlife crisis; Short vacations; Sudden death; England--London; New York (State)--New York
Genres: Video recordings; Motion pictures; Fiction films; Comedy films; Drama; Feature films; Video recordings for the hearing impaired
Provision information: [New York, N.Y.]: The Criterion Collection, [2020]; Blu-ray special edition","7001 $aBrown, Lewis,$ecostume designer.$0http://id.loc.gov/authorities/names/n97859371","Brown, Lewis",Costume designer,Husbands: a comedy about life and death and freedom,"Columbia ; Al Ruban and Sam Shaw present ; written and directed by John Cassavetes ; producer, Al Ruban","[New York, N.Y.]: The Criterion Collection, [2020] Blu-ray special edition",Husbands--New York (State)--New York--Drama; Midlife crisis--New York (State)--New York--Drama; Short vacations--England--London--Drama; Sudden death--New York (State)--New York--Drama; Husbands; Midlife crisis; Short vacations; Sudden death; England--London; New York (State)--New York,Video recordings; Motion pictures; Fiction films; Comedy films; Drama; Feature films; Video recordings for the hearing impaired,,15767059,15767059-f4e29839-2818-4be6-bed3-2cc834c73100#http://id.loc.gov/rwo/agents/n97859371,Performing Arts and Media,False
4438.1,"Title: Husbands: a comedy about life and death and freedom
Subjects: Husbands--New York (State)--New York--Drama; Midlife crisis--New York (State)--New York--Drama; Male friendship--New York (State)--New York--Drama; Short vacations--England--London--Drama; Sudden death--New York (State)--New York--Drama; Husbands; Male friendship; Midlife crisis; Short vacations; Sudden death; England--London; New York (State)--New York
Genres: Video recordings; Motion pictures; Comedy films; Drama; Feature films; Fiction films; Video recordings for the hearing impaired
Provision information: [New York, N.Y.]: The Criterion Collection, [2020]; Two-DVD special edition","7001 $aBrown, Lewis,$ecostume designer.$0http://id.loc.gov/authorities/names/n97859371","Brown, Lewis",Costume designer,Husbands: a comedy about life and death and freedom,"Columbia ; Al Ruban and Sam Shaw present ; written and directed by John Cassavetes ; producer, Al Ruban","[New York, N.Y.]: The Criterion Collection, [2020] Two-DVD special edition",Husbands--New York (State)--New York--Drama; Midlife crisis--New York (State)--New York--Drama; Male friendship--New York (State)--New York--Drama; Short vacations--England--London--Drama; Sudden death--New York (State)--New York--Drama; Husbands; Male friendship; Midlife crisis; Short vacations; Sudden death; England--London; New York (State)--New York,Video recordings; Motion pictures; Comedy films; Drama; Feature films; Fiction films; Video recordings for the hearing impaired,,15766979,15766979-4a05d9a8-06f8-479b-b873-d07084eef0c7#http://id.loc.gov/rwo/agents/n97859371,Performing Arts and Media,False
4552.0,"Title: Ceramics now: Jane Hartsook Gallery's 2019 exhibition series
Subjects: Ceramic sculpture--21st century--Exhibitions; Pottery--21st century--Exhibitions; Pichaske, Lindsay--Exhibitions; Tiravanija, Rirkrit, 1961---Exhibitions; Powell, Joanna--Exhibitions; Holt, Lisa--Exhibitions; Reano, Holt--Exhibitions; Staley, Chris--Exhibitions; Goff, Shannon--Exhibitions; Johnson, Peter Christian, 1976---Exhibitions; Mabry, Lauren, 1985---Exhibitions; Jakielski, Janice--Exhibitions; Tiravanija, Rirkrit, 1961-; Ceramic sculpture; Pottery; 2000-2099
Genres: Exhibition catalogs
Provision information: New York: Jane Hartsook Gallery at Greenwich House Pottery, [2020]","7001 $aMiller, Leslie,$d1957-$ebook designer.$0http://id.loc.gov/authorities/names/n95028632","Miller, Leslie, 1957-",Book designer,Ceramics now: Jane Hartsook Gallery's 2019 exhibition series,,"New York: Jane Hartsook Gallery at Greenwich House Pottery, [2020]","Ceramic sculpture--21st century--Exhibitions; Pottery--21st century--Exhibitions; Pichaske, Lindsay--Exhibitions; Tiravanija, Rirkrit, 1961---Exhibitions; Powell, Joanna--Exhibitions; Holt, Lisa--Exhibitions; Reano, Holt--Exhibitions; Staley, Chris--Exhibitions; Goff, Shannon--Exhibitions; Johnson, Peter Christian, 1976---Exhibitions; Mabry, Lauren, 1985---Exhibitions; Jakielski, Janice--Exhibitions; Tiravanija, Rirkrit, 1961-; Ceramic sculpture; Pottery; 2000-2099",Exhibition catalogs,,16226821,16226821-8580636d-a510-4ce6-9622-04bac76f64d3#http://id.loc.gov/rwo/agents/n95028632,Visual Arts and Design,False
4552.0,"Title: Life & death
Variant titles: Life and death; Black paintings
Subjects: Clemente, Francesco, 1952---Exhibitions; Clemente, Francesco, 1952-
Genres: Poetry; Exhibition catalogs
Provision information: New York: Gagosian Gallery, 1993","7001 $aMiller, Leslie,$d1957-$ebook designer.$0http://id.loc.gov/authorities/names/n95028632","Miller, Leslie, 1957-",Book designer,Life & death,Robert Creeley,"New York: Gagosian Gallery, 1993","Clemente, Francesco, 1952---Exhibitions; Clemente, Francesco, 1952-",Poetry; Exhibition catalogs,,15646245,15646245-839af6a6-cbb4-43b4-9589-39c8177dff22#http://id.loc.gov/rwo/agents/n95028632,Visual Arts and Design,False
4552.0,"Title: Brice Marden: recent drawings and etchings
Subjects: Marden, Brice, 1938---Exhibitions; Drawing--United States--20th century--Exhibitions; Drawing, American--Exhibitions; Etching, American--Exhibitions; Etching--United States--20th century--Exhibitions; Marden, Brice, 1938-; Drawing; Drawing, American; Etching; Etching, American; United States; 1900-1999
Genres: Catalogs; Exhibition catalogs
Provision information: New York: M. Marks, 1991","7001 $aMiller, Leslie,$d1957-$ebook designer.$0http://id.loc.gov/authorities/names/n95028632","Miller, Leslie, 1957-",Book designer,Brice Marden: recent drawings and etchings,with an interview by Pat Steir,"New York: M. Marks, 1991","Marden, Brice, 1938---Exhibitions; Drawing--United States--20th century--Exhibitions; Drawing, American--Exhibitions; Etching, American--Exhibitions; Etching--United States--20th century--Exhibitions; Marden, Brice, 1938-; Drawing; Drawing, American; Etching; Etching, American; United States; 1900-1999",Catalogs; Exhibition catalogs,,15611298,15611298-1aa2678a-a871-491c-b560-c0587578d19d#http://id.loc.gov/rwo/agents/n95028632,Visual Arts and Design,False
4552.0,"Title: Ex libris: NYPL
Subjects: Celmins, Vija, 1938---Autograph; Mangold, Robert, 1937---Autograph; Moore, Frank, 1953-2002--Autograph; Murray, Elizabeth, 1940-2007--Autograph; Rothenberg, Susan, 1945-2000--Autograph
Genres: Bookplates
Provision information: [New York]: Published by the Miriam and Ira D. Wallach Division of Art, Prints, and Photographs, for the benefit of the New York Public Library, 1996","7001 $aMiller, Leslie,$d1957-$eprinter.$0http://id.loc.gov/authorities/names/n95028632","Miller, Leslie, 1957-",Printer,Ex libris: NYPL,,"[New York]: Published by the Miriam and Ira D. Wallach Division of Art, Prints, and Photographs, for the benefit of the New York Public Library, 1996","Celmins, Vija, 1938---Autograph; Mangold, Robert, 1937---Autograph; Moore, Frank, 1953-2002--Autograph; Murray, Elizabeth, 1940-2007--Autograph; Rothenberg, Susan, 1945-2000--Autograph",Bookplates,,15665067,15665067-2d29e274-95bd-4425-a08d-fc71be85a1db#http://id.loc.gov/rwo/agents/n95028632,Literature and Narrative Arts,False
4552.0,"Title: Lucian Freud, recent drawings and etchings: including an interview with the artist
Subjects: Freud, Lucian--Exhibitions; Freud, Lucian
Genres: Catalogs; Exhibition catalogs
Provision information: New York: Matthew Marks Gallery, 1993","7001 $aMiller, Leslie,$d1957-$ebook designer.$0http://id.loc.gov/authorities/names/n95028632","Miller, Leslie, 1957-",Book designer,"Lucian Freud, recent drawings and etchings: including an interview with the artist",by Leigh Bowery ; & an essay by Angus Cook,"New York: Matthew Marks Gallery, 1993","Freud, Lucian--Exhibitions; Freud, Lucian",Catalogs; Exhibition catalogs,,15658846,15658846-9909f87e-e710-437e-8e07-e15fe122611e#http://id.loc.gov/rwo/agents/n95028632,Visual Arts and Design,False
